id,sku,short_description,price,list_price,price_usd,discount,discount_rate,review_count,order_count,inventory_status,is_visible,stock_item_qty,stock_item_max_sale_qty,product_name,brand_id,brand_name
125182567,4604296397887,Amazon vừa chính thức ra mắt thế hệ tiếp theo của dòng máy đọc sách Kindle Paperwhite.Kindle Paperwhite 5 (hay Kindle Paperwhite 11th Gen) là phiên bản thay thế cho chiếc Kindle Paperwhite 4 đã ra ...,3410000,3990000,,580000,15,353,,available,,1000,1000,,147856,Kindle
36264193,8494418937805,"Kindle Paperwhite Gen 10 - 2019 vừa được ra mắt sau một chu kỳ dài hơn 3 năm và nó có màn hình phẳng, chống thấm nước và Bluetooth. Đây là Kindle Paperwhite đầu tiên có tích hợp Audiobook Audible, ch...",2850000,2850000,,0,0,169,,available,,1000,1000,,147856,Kindle
173387789,3214054442334,"Độ phân giải màn hình cực caoMáy đọc sách All New Kindle Oasis 3 với màn hình 7 inch và mật độ ảnh 300 ppi, văn bản hiển thị trên thiết bị với chất lượng sắc nét, đọc như giấy thật ngay cả trong ánh ...",5680000,5680000,,0,0,11,,available,,1000,1000,,147856,Kindle
217706932,8671886696124,Amazon vừa chính thức ra mắt thế hệ tiếp theo của dòng máy đọc sách Kindle Paperwhite.Kindle Paperwhite 5 (hay Kindle Paperwhite 11th Gen) là phiên bản thay thế cho chiếc Kindle Paperwhite 4 đã ra ...,3420000,3990000,,570000,14,116,,available,,1000,1000,,147856,Kindle
252586291,8259108068504,  Amazon vừa chính thức ra mắt thế hệ tiếp theo của dòng máy đọc sách Kindle Paperwhite.Kindle Paperwhite 5 (hay Kindle Paperwhite 11th Gen) là phiên bản thay thế cho chiếc Kindle Paperwhite ...,3990000,3990000,,0,0,97,,available,,1000,1000,,147856,Kindle
205750556,3682930546762,"Điện Thoại Oppo A57 4GB/128GB - Hàng Chính HãngBộ sản phẩm bao gồm: Thân máy, bộ sạc, cáp USB, dụng cụ lấy sim, sách hướng dẫn, ốp lưng điện thoại. Màn hình tràn viền, sắc nét- OPPO trang bị cho m...",3290000,4990000,,1700000,34,61,,available,,1000,1000,,25643,OPPO
271973414,7601310945460,"Nội dung quảng cáoGiờ đây với thiết kế titan nhẹ và bền chắc, cùng chip A17 Pro cho khả năng đa nhiệm khủng. Bắt trọn những khoảnh khắc đặc biệt khi đang di chuyển với hệ thống camera chuyên nghiệp l...",33490000,33490000,,0,0,58,,available,,1000,1000,,17827,Apple
91612670,6549204947898,"Thiết kế tinh xảo với mặt lưng bóng bẩyĐiện thoại OPPO A54 có thiết kế kiểu thiết kế tràn viền, giúp cho chiếc điện thoại có một màn hình siêu lớn nhưng vẫn vừa vặn trong lòng bàn tay, phù hợp cho mọ...",3090000,5990000,,2900000,48,239,,available,,1000,1000,,25643,OPPO
57809866,6693737306374,"Màn hình giọt nước, viền máy mỏngĐiện thoại Xiaomi Redmi 9A sở hữu một màn hình tràn viền kích thước cực lớn 6.53 inch với thiết kế theo kiểu giọt nước quen thuộc, đi theo xu hướng chung của những mẫ...",1790000,2490000,,700000,28,757,,available,,1000,1000,,25422,Xiaomi
271966786,3577192583861,"Nội dung quảng cáoiPhone 15 sở hữu Dynamic Island, camera Chính 48MP và USB-C trong thiết kế bằng kính pha màu và nhôm bền bỉ. Tính năng nổi bậtDYNAMIC ISLAND RA MẮT TRÊN IPHONE 15 — Dynamic Isla...",20990000,20990000,,0,0,24,,available,,1000,1000,,17827,Apple
271362153,1176146850399,Amazon vừa chính thức ra mắt thế hệ tiếp theo của dòng máy đọc sách Kindle Paperwhite.Kindle Paperwhite 5 (hay Kindle Paperwhite 11th Gen) là phiên bản thay thế cho chiếc Kindle Paperwhite 4 đã ra ...,3590000,4590000,,1000000,22,0,,available,,1000,1000,,147856,Kindle
270510406,4763759740069,...,5790000,6290000,,500000,8,0,,available,,1000,1000,,52232,Vivo
163914808,3951612829798,"Treo tường hoặc để bànĐiều chỉnh âm lượng, chuôngQuay số nhanhĐèn tín hiệuSản xuất tại MalaysiaBảo hành 1 năm chính hãng Panasonic Giá bán đã thuế 10% VAT...",290000,300000,,10000,3,121,,available,,1000,1000,,18804,Panasonic
272909668,6076389297807,...,8990000,8990000,,0,0,0,,available,,1000,1000,,52232,Vivo
217645692,6487670580863,Amazon vừa chính thức ra mắt thế hệ tiếp theo của dòng máy đọc sách Kindle Paperwhite.Kindle Paperwhite 5 (hay Kindle Paperwhite 11th Gen) là phiên bản thay thế cho chiếc Kindle Paperwhite 4 đã ra ...,3890000,3890000,,0,0,0,,available,,1000,1000,,147856,Kindle
271972435,1237118640452,"Nội dung quảng cáoiPhone 15 Pro. Được đúc từ titan và trang bị chip A17 Pro đột phá, nút Tác Vụ có thể tùy chỉnh, và hệ thống camera chuyên nghiệp linh hoạt hơn. Tính năng nổi bậtĐƯỢC ĐÚC TỪ TI...",27490000,27490000,,0,0,23,,available,,1000,1000,,17827,Apple
183330021,7453477983299,"Nội dung quảng cáoMạnh mẽ. Dễ sử dụng. Linh hoạt. iPad có màn hình Retina 10.2 inch tuyệt đẹp, chip A13 Bionic mạnh mẽ, camera trước Ultra Wide có tính năng Trung Tâm Màn Hình, tương thích với Apple ...",6990000,10990000,,4000000,36,867,,available,,1000,1000,,17827,Apple
125182567,4604296397887,Amazon vừa chính thức ra mắt thế hệ tiếp theo của dòng máy đọc sách Kindle Paperwhite.Kindle Paperwhite 5 (hay Kindle Paperwhite 11th Gen) là phiên bản thay thế cho chiếc Kindle Paperwhite 4 đã ra ...,3410000,3990000,,580000,15,353,,available,,1000,1000,,147856,Kindle
197670818,2942333865801,"Rộng mở thêm trải nghiệmGiải trí bất tận mỗi ngày, thoải mái thưởng thức nhiều nội dung hơn với màn hình tràn viền vô cực Infinity-V 6,5inch trên Điện thoại Samsung Galaxy A04s. Tận hưởng nội dung hi...",2890000,3990000,,1100000,28,47,,available,,1000,1000,,18802,Samsung
214756058,5239906950205,"Sản phẩm đầu tiên thuộc dòng basic có độ phân giải 300ppiMáy đọc sách New Kindle 11th 2022 (16GB) được nâng cấp với màn hình độ phân giải 300ppi (so với 167ppi) của đời trước, cổng kết nối USB-Type C...",2650000,3190000,,540000,17,47,,available,,1000,1000,,147856,Kindle
201067649,6927586640656, ...,3390000,3990000,,600000,15,101,,available,,1000,1000,,147856,Kindle
181928619,6795214532367,"Màn hình LCD 1.6” hiển thị rõ nét, đèn màn hình màu cam.- Danh bạ lưu 50 tên và số, chia sẻ danh bạ giữa các tay con- Hiển thị 50 số gọi đến- Nhớ 10 số gọi đi- 6 số gọi nhanh- Đàm thoại 3 bên- Loa ...",990000,990000,,0,0,13,,available,,1000,1000,,18804,Panasonic
226552005,5087831143894,"– Nhớ 50 số gọi đến 10 số gọi đi.– Khoá đường dài, di động bằng mã._ Hiển thị số gọi đến, gọi đi  Bảo hành 12 tháng chính hãngGiá bán đã bao gồm xuất hoá đơn 10% VAT Lưu ý: Điện thoại khô...",588000,588000,,0,0,21,,available,,1000,1000,,18804,Panasonic
202182043,5246263463940,"Không gian hiển thị sắc nétVivo Y35 có kích thước màn hình 6.58 inch đi cùng là tấm nền IPS LCD, độ phân giải Full HD+ với những thông số trên chất lượng hình ảnh hiển thị có chi tiết tốt, góc nhìn r...",4590000,6990000,,2400000,34,0,,available,,1000,1000,,52232,Vivo
181927801,5355086404171,"Màn hình LCD 1.6” hiển thị rõ nét, đèn màn hình màu cam.- Danh bạ lưu 50 tên và số, chia sẻ danh bạ giữa các tay con- Hiển thị 50 số gọi đến, 10 số gọi đi, 6 số gọi nhanh- Đàm thoại 3 bên- Loa ngo...",1590000,1590000,,0,0,13,,available,,1000,1000,,18804,Panasonic
120295859,8479763016056,"Nokia C30 là dòng smartphone giá rẻ được Nokia chăm chút và đầu tư kỹ lưỡng với những nâng cấp đáng kể cả về ngoại hình lẫn hiệu năng, hứa hẹn mang đến cho người dùng những trải nghiệm tuyệt vời hơn b...",1490000,1990000,,500000,25,176,,available,,1000,1000,,19673,Nokia
184059211,3643515408223,iPhone 13. Hệ thống camera kép tiên tiến nhất từng có trên iPhone. Chip A15 Bionic thần tốc. Bước nhảy vọt về thời lượng pin. Thiết kế bền bỉ. Mạng 5G siêu nhanh.1 Cùng với màn hình Super Retina XDR s...,16090000,24990000,,8900000,36,1793,,available,,1000,1000,,17827,Apple
271967379,6750971196270,Nội dung quảng cáoLuôn cập nhật những thông tin mới nhất cho công việc của bạn với các cảnh báo trên Dynamic Island và Hoạt Động Trực Tiếp. Biến những sản phẩm tốt nhất của bạn trở nên sống động với ...,24990000,24990000,,0,0,9,,available,,1000,1000,,17827,Apple
270471106,9150084549199,"Thiết kế nhỏ gọn, mặt lưng nhám bám tay  Nếu bạn đang muốn tìm kiếm một chiếc điện thoại có bàn phím vật lý, thì Nokia vẫn luôn là thương hiệu được nghĩ đến đầu tiên. Những chiếc điện thoại Nokia nổi...",650000,680000,,30000,4,17,,available,,1000,1000,,19673,Nokia
184253251,7026135914764,"iPad Air. Với màn hình Liquid Retina 10.9 inch sống động.1 Chip Apple M1 đột phá cho hiệu năng nhanh hơn, giúp iPad Air trở nên siêu mạnh mẽ để sáng tạo và chơi game di động. Sở hữu Touch ID, camera t...",13650000,18990000,,5340000,28,226,,available,,1000,1000,,17827,Apple
197214015,1813388284666,"Nội dung quảng cáoiPhone 14 Plus. Nghĩ lớn cùng màn hình 6,7 inch lớn hơn1 và thời lượng pin bền bỉ cả ngày.2 Chụp những bức ảnh tuyệt đẹp trong điều kiện thiếu sáng và dư sáng cùng hệ thống camera k...",20990000,27990000,,7000000,25,129,,available,,1000,1000,,17827,Apple
175845367,1676834040443,"Màn hình giải trí siêu mượt 120 HzSamsung Galaxy S20 FE được trang bị màn hình siêu tràn viền Infinity-O có kích thước 6.5 inch đi cùng tấm nền Super AMOLED, độ phân giải Full HD+ cho người dùng dễ ...",7090000,9990000,,2900000,29,193,,available,,1000,1000,,18802,Samsung
271046571,5969003526113,"Vẻ ngoài thời trang cùng màu sắc mới mẻRedmi Note 12 được tạo hình bằng một vẻ ngoài quen thuộc với các cạnh cùng hai mặt vát phẳng tinh tế, những vị trí giao nhau giữa mặt lưng và bộ khung cũng sẽ đ...",4490000,4530000,,40000,1,12,,available,,1000,1000,,25422,Xiaomi
197216291,7801946163627,Nội dung quảng cáoiPhone 14 Pro Max. Bắt trọn chi tiết ấn tượng với Camera Chính 48MP. Trải nghiệm iPhone theo cách hoàn toàn mới với Dynamic Island và màn hình Luôn Bật. Công nghệ an toàn quan trọng...,26450000,33990000,,7540000,22,527,,available,,1000,1000,,17827,Apple
270978283,3753016164978,"Thiết kế hiện đại, thanh lịchĐiện thoại Galaxy A34 5G sở hữu thiết kế khác hoàn toàn so với thế hệ tiền nhiệm Galaxy A33 5G 128GB. Vẻ ngoài của chiếc điện thoại mới này khá giống với Galaxy S23 5G 25...",5990000,8490000,,2500000,29,10,,available,,1000,1000,,18802,Samsung
250109584,5991957515400,"Xiaomi Redmi Note 12 4GB có thể xem là cái tên rất đáng chú ý trong phân khúc điện thoại tầm trung hiện nay với nhiều ưu điểm nổi bật, sở hữu con chip Snapdragon 685 cùng bộ 3 cảm biến máy ảnh có độ p...",3750000,4990000,,1240000,25,7,,available,,1000,1000,,25422,Xiaomi
253269077,7540957020809,   ...,3290000,4490000,,1200000,27,28,,available,,1000,1000,,18802,Samsung
252586291,8259108068504,  Amazon vừa chính thức ra mắt thế hệ tiếp theo của dòng máy đọc sách Kindle Paperwhite.Kindle Paperwhite 5 (hay Kindle Paperwhite 11th Gen) là phiên bản thay thế cho chiếc Kindle Paperwhite ...,3990000,3990000,,0,0,97,,available,,1000,1000,,147856,Kindle
205815593,1377439255070,"Apple iPad Pro 11-inch M2 Wi-Fi, 2022Nội dung về tính năngiPad Pro. Với hiệu năng ấn tượng, kết nối không dây siêu nhanh và trải nghiệm Apple Pencil thế hệ mới. Cùng với các tính năng mới mạnh mẽ ch...",19990000,23990000,,4000000,17,89,,available,,1000,1000,,17827,Apple
197216279,1974938370781,"Nội dung quảng cáoiPhone 14 Pro. Bắt trọn chi tiết ấn tượng với Camera Chính 48MP. Trải nghiệm iPhone theo cách hoàn toàn mới với Dynamic Island và màn hình Luôn Bật. Phát Hiện Va Chạm,1 một tính năn...",23990000,30990000,,7000000,23,264,,available,,1000,1000,,17827,Apple
272270730,7044203760003,...,2999000,3090000,,91000,3,0,,available,,1000,1000,,18802,Samsung
271467653,2446167505131,"Thiết kế trẻ trung hiện đạiRealme C51 là mẫu máy có thiết kế nguyên khối được tạo hình theo kiểu phẳng ở cả mặt lưng và màn hình. Với góc cạnh vuông vức, chiếc điện thoại mang đến một cảm giác mạnh m...",3190000,3990000,,800000,20,2,,available,,1000,1000,,247549,Realme
201067649,6927586640656, ...,3390000,3990000,,600000,15,101,,available,,1000,1000,,147856,Kindle
272222033,1009596276042,"BOOX PALMAGiải phóng sức mạnh của Máy đọc sách di độngVỚI PALMAThiết bị máy đọc sách đầu tiên của Boox được thiết kế với kích thước bằng điện thoại, sử dụng màn hình E-ink với hiệu suất tiên tiến,...",7300000,8590000,,1290000,15,1,,available,,1000,1000,,183637,Onyx Boox
270978486,6460434938850,"Thiết kế hiện đại, kiểu dáng vuông vức hợp xu hướngNgười sử dụng đánh giá khá cao về phần thiết kế bên ngoài của Galaxy M14 với những đường nét cong bo vô cùng tinh tế ở vị trí 4 góc. Phần khung viền...",4490000,5490000,,1000000,18,3,,available,,1000,1000,,18802,Samsung
184036446,9320936798992,"Nội dung về tính năngQuay video 4K, chụp ảnh chân dung tuyệt đẹp và chụp phong cảnh rộng với hệ thống camera kép hoàn toàn mới. Chụp ảnh tối ưu trong điều kiện ánh sáng yếu với chế độ Ban Đêm. Xem ản...",10490000,12990000,,2500000,19,2967,,available,,1000,1000,,17827,Apple
217706932,8671886696124,Amazon vừa chính thức ra mắt thế hệ tiếp theo của dòng máy đọc sách Kindle Paperwhite.Kindle Paperwhite 5 (hay Kindle Paperwhite 11th Gen) là phiên bản thay thế cho chiếc Kindle Paperwhite 4 đã ra ...,3420000,3990000,,570000,14,116,,available,,1000,1000,,147856,Kindle
270814388,4607467260431," *Thông số kỹ thuậtNền tảng chip 6nm Helio G99 ; Điểm Antutu +380.000Màn hình làm 6,78 FHD+120HzBộ nhớ vượt trội 128/256 + 8GBLàm mát Vapor Champer, âm thanh nổi kép YangĐộng cơ tuyến tính trụ...",3990000,4490000,,500000,11,15,,available,,1000,1000,,162007,Tecno
220680981,8289637910624,"Realme 10 có thể xem là một trong những mẫu smartphone đáng mong đợi nhất trong dịp đầu năm 2023 với nhiều điểm nổi bật, một số điểm đáng chú ý có thể kể đến như: Tấm nền Super AMOLED, camera siêu độ ...",5600000,7190000,,1590000,22,13,,available,,1000,1000,,247549,Realme
216173180,2870045370441,"Cảm hứng từ muôn sắc màu thiên nhiênGặp gỡ muôn sắc màu thiên nhiên trên Samsung Galaxy S23 5G, bạn sẽ ngạc nhiên vì nét đẹp cuốn hút này. Nét đẹp khó nhầm lẫn với bất kỳ đại diện nào.Các sắc màu t...",16990000,24990000,,8000000,32,1,,available,,1000,1000,,18802,Samsung
270447782,3887768373456,...,2790000,3290000,,500000,15,15,,available,,1000,1000,,19673,Nokia
163914808,3951612829798,"Treo tường hoặc để bànĐiều chỉnh âm lượng, chuôngQuay số nhanhĐèn tín hiệuSản xuất tại MalaysiaBảo hành 1 năm chính hãng Panasonic Giá bán đã thuế 10% VAT...",290000,300000,,10000,3,121,,available,,1000,1000,,18804,Panasonic
171897574,4859085307208,"Snapdragon 680 mạnh mẽ, tiết kiệm điệnĐiện thoại Xiaomi Redmi 10C được tích hợp bộ vi xử lý tám nhân với tên gọi Snapdragon 680. Đây là con chip sản xuất trên tiến trình 6nm đem lại hiệu năng hàng đầ...",2990000,4390000,,1400000,32,57,,available,,1000,1000,,25422,Xiaomi
252427658,9636307258725,"SPARK 10 Pro 8GB/256GB Thiết kế hợp thời trang, Chất liệu pha lê ánh sao, Bụi kim cương phát sáng, Thiết kế bộ 3 camera thời thượng* Thông số kỹ thuật- C...",3549000,3990000,,441000,11,25,,available,,1000,1000,,162007,Tecno
184248127,2776157246765,iPad mini. Thiết kế màn hình toàn phần với màn hình Liquid Retina 8.3 inch.1 Chip A15 Bionic mạnh mẽ với Neural Engine. Camera trước Ultra Wide 12MP với tính năng Trung Tâm Màn Hình. Cổng kết nối USB-...,11250000,14990000,,3740000,25,161,,available,,1000,1000,,17827,Apple
270471101,3030605882910,"Thiết kế cổ điển khó bị nhầm lẫnPhân khúc điện thoại phổ thông dần trở nên sôi động, và đây là một phân khúc thiết bị di động mà Nokia hay đúng hơn là HMD Global đang tích cực cải tiến. Tại thời điểm...",690000,710000,,20000,3,6,,available,,1000,1000,,19673,Nokia
197905982,4686678356638,"Thông tin sản phẩm Vtel E10 4GMàn hình: 1.77 inchBăng tần 2G, 3G: GSM850/900/1800/1900Băng tần 4G: B1(2100),B3(1800),B5(850),B8(900)Bộ nhớ: 48MB + 128MBDanh bạ: 2.000 sốPin: 1,000 mAhFM: Loa ng...",349000,349000,,0,0,12,,available,,1000,1000,,573293,Vtel
248590019,5102856839519,"Đặc điểm nổi bật của Xiaomi Redmi 12C 3GB - 32GBThông số kỹ thuậtMàn hình 6.71 inch, IPS LCD, HD+, 720 x 1650 PixelsCamera sau 50.0 MP + 0.08 MPCamera Selfie 5.0 MP + 5.0 MPRAM 4 GBBộ nhớ trong ...",2049000,3590000,,1541000,43,5,,available,,1000,1000,,25422,Xiaomi
244308977,8830637809755,"Điện Thoại Xiaomi Redmi 12C 4GB/64GB - Hàng Chính HãngBộ sản phẩm bao gồm: Pin, sạc, cáp USB, hướng dẫn, cây tháo sim. Màn hình sắc nét, giải trí đỉnh caoMàn hình của Redmi 12C có kích thước 6.71 ...",2490000,3590000,,1100000,31,23,,available,,1000,1000,,25422,Xiaomi
250111470,5636369625689,"Xiaomi Redmi Note 12 4GB có thể xem là cái tên rất đáng chú ý trong phân khúc điện thoại tầm trung hiện nay với nhiều ưu điểm nổi bật, sở hữu con chip Snapdragon 685 cùng bộ 3 cảm biến máy ảnh có độ p...",4450000,5790000,,1340000,23,8,,available,,1000,1000,,25422,Xiaomi
247823537,4349454220044,"Bài viết đánh giáGần đây, chiếc điện thoại Realme C55 đã được giới thiệu chính thức với bộ thông số kỹ thuật đáng chú ý và giá cả phù hợp cho người dùng, hãng tạo ra sản phẩm này nhằm cải thiện trải ...",3990000,4790000,,800000,17,43,,available,,1000,1000,,247549,Realme
270977740,8148891524434,...,7490000,10490000,,3000000,29,3,,available,,1000,1000,,18802,Samsung
123345348,6352768705236,"Điện Thoại iPhone 12iPhone 12 đẩy nhanh mọi tác vụ với mạng 5G siêu nhanh.1 A14 Bionic, chip nhanh nhất trên điện thoại thông minh. Hệ thống camera kép mới. Với màn hình Super Retina XDR tuyệt đẹp, n...",13350000,16990000,,3640000,21,1268,,available,,1000,1000,,17827,Apple
197214029,1840508024491,"Nội dung quảng cáoiPhone 14. Với hệ thống camera kép tiên tiến nhất từng có trên iPhone. Chụp những bức ảnh tuyệt đẹp trong điều kiện từ thiếu sáng đến dư sáng. Phát hiện Va Chạm,1 một tính năng an t...",18650000,24990000,,6340000,25,133,,available,,1000,1000,,17827,Apple
198648645,7102904755207,"Thiết kế mặt da lưng sang trọngĐiện thoại Xiaomi Redmi A1 có thiết kế hoàn toàn mới cả về vẻ bề ngoài lẫn trải nghiệm cầm nắm. Mặt lưng của máy được hoàn thiện từ da sang trọng, rất thời trang và tạo...",1690000,2490000,,800000,32,33,,available,,1000,1000,,25422,Xiaomi
170497385,6551724643612,"Thiết kế tối giảnĐiện thoại Samsung Galaxy A53 5G có thiết kế lấy từ cảm hứng tối giản với sự kết hợp hài hòa tỉ mỉ trong từng đường nét, nhưng lại hội tụ trọn bộ đột phá bên trong, Samsung Galaxy A5...",6990000,9990000,,3000000,30,184,,available,,1000,1000,,18802,Samsung
230157205,3684006639942,"Cấu hình Điện thoại Xiaomi Redmi Note 10TMàn hình: IPS LCD6.5""Full HD+Hệ điều hành: Android 11Camera sau: Chính 50 MP & Phụ 2 MP, 2 MPCamera trước: 8 MPChip: Qualcomm Snapdragon 480RAM: 4 GB...",2599000,4190000,,1591000,38,9,,available,,1000,1000,,25422,Xiaomi
247730209,4248112816958,"Thiết kế hiện đại, thanh lịchĐiện thoại Galaxy A34 5G sở hữu thiết kế khác hoàn toàn so với thế hệ tiền nhiệm Galaxy A33 5G 128GB. Vẻ ngoài của chiếc điện thoại mới này khá giống với Galaxy S23 5G 25...",6990000,8490000,,1500000,18,18,,available,,1000,1000,,18802,Samsung
249890677,1255206814358,"Điện Thoại Xiaomi Redmi Note 12 4GB/128GB - Hàng Chính HãngBộ sản phẩm bao gồm: Pin, sạc, cáp USB kiểu C, ốp lưng, hướng dẫn, cây tháo sim.Màn hình rộng hiển thị tuyệt vời từ nhiều góc nhìn- Redmi...",3879000,4990000,,1111000,22,45,,available,,1000,1000,,25422,Xiaomi
249143473,3233628661722,"Được giới thiệu vào tháng 03/2023, Samsung Galaxy A34 5G 128GB là một lựa chọn đáng chú ý trong thị trường điện thoại Android tầm trung. Với kết nối 5G tiên tiến và hiệu suất đáng tin cậy, sản phẩm hứ...",5990000,8490000,,2500000,29,7,,available,,1000,1000,,18802,Samsung
270714226,1318020597988," *Thông số kỹ thuật:- Bộ nhớ mở rộng: RAM 8GB(4GB+4GB) ROM: 128GB- Màn hình: IPS LCD 6,6"" ,Độ phân giải HD+- Tần số quét: 90Hz- Dung lượng p...",2290000,2590000,,300000,12,9,,available,,1000,1000,,111684,Itel
197907038,5012695209637,"Thông tin sản phẩm Vtel E10 4GMàn hình: 1.77 inchBăng tần 2G, 3G: GSM850/900/1800/1900Băng tần 4G: B1(2100),B3(1800),B5(850),B8(900)Bộ nhớ: 48MB + 128MBDanh bạ: 2.000 sốPin: 1,000 mAhFM: Loa ng...",339000,339000,,0,0,27,,available,,1000,1000,,573293,Vtel
247730281,2852175427722,...,8690000,10490000,,1800000,17,22,,available,,1000,1000,,18802,Samsung
247731336,7656285866781,...,9290000,11490000,,2200000,19,20,,available,,1000,1000,,18802,Samsung
258667842,2465642183734,"Hãng Xiaomi đã tiếp tục cho ra mắt mẫu điện thoại mới của mình trong năm 2023 với tên gọi Xiaomi Redmi Note 12 Pro 4G (8GB/256GB) được định hình là dòng sản phẩm thuộc phân khúc tầm trung, sở hữu nhiề...",6750000,7990000,,1240000,16,5,,available,,1000,1000,,25422,Xiaomi
140309479,9797451771083,"Điện thoại Masstel Hapi 15 2GB/16GB*Màu Sắc Black, Blue, Gold*Màn hình5.45″ HD- IPS (1132*540 px)*Hỗ Trợ 2 SIM 2 sóng, PIN: 2200mAh*Hệ Điều Hành Android 11 Go Edition*Camera Sau 5MP (Flash)*Came...",799000,1299000,,500000,38,15,,available,,1000,1000,,112638,Masstel
209872337,9544010779799,    ...,2720000,3100000,,380000,12,9,,available,,1000,1000,,147856,Kindle
259542697,3484252155506,"Xiaomi Redmi Note 12S sẽ là chiếc điện thoại tiếp theo được nhà Xiaomi tung ra thị trường Việt Nam trong tháng 05/2023. Điện thoại sở hữu một lối thiết kế hiện đại, màn hình hiển thị chi tiết đi cùng...",4690000,6690000,,2000000,30,12,,available,,1000,1000,,25422,Xiaomi
270814316,2270219015003,"*Thông số kỹ thuậtNền tảng chip 6nm Helio G99 ; Điểm Antutu +380.000Màn hình làm 6,78 FHD+120HzBộ nhớ vượt trội 128/256 + 8GBLàm mát Vapor Champer, âm thanh nổi kép YangĐộng cơ tuyến tính trục ...",4690000,5290000,,600000,11,6,,available,,1000,1000,,162007,Tecno
257682739,7610430156171,"Điện thoại sở hữu tấm nền IPS LCD, độ phân giải HD+ cùng kích thước 6.5 inch mang đến không gian giải trí thoải mái, phù hợp với các nhu cầu giải trí của đại đa số người dùng.Cũng như các Điện thoại...",2150000,2990000,,840000,28,5,,available,,1000,1000,,18802,Samsung
179547641,3301286969393,"Chất liệu không thấm nước và màu sắc thời thượngMáy đọc sách Kindle Paperwhite 5 khoác lên mình một màu đen sang trọng, tinh tế với chất liệu không thấm nước khá bền bỉ. Ngoài ra, Kindle Paperwhite 5...",3410000,4990000,,1580000,32,105,,available,,1000,1000,,147856,Kindle
260986508,9187096744367,"Nhỏ gọn. Thân thiện. Tiện ích.Máy đọc sách 6"" nhỏ gọn nhấtNhờ cấu trúc bên trong được tối ưu hóa, Poke5 tự hào có tỷ lệ màn hình so với thân máy tuyệt vời mà không máy đọc sách nào có thể so sánh đ...",4720000,5990000,,1270000,21,4,,available,,1000,1000,,183637,Onyx Boox
262845685,8424405965157,"Mô tả sản phẩm Fonrox F2160Pin dung lượng lớn 1150 mAhÂm thanh nổi 3DSim kép, chế độ chờ képThông tin cơ bảnNhãn hiệu/mẫu: Fonrox F2160Khe Cắm Thẻ Sim: Hai Sim, hai chế độ chờLoại thẻ Sim: 1 thẻ tiê...",259000,299000,,40000,13,4,,available,,1000,1000,,111461,OEM
