id,sku,short_description,price,list_price,price_usd,discount,discount_rate,review_count,order_count,inventory_status,is_visible,stock_item_qty,stock_item_max_sale_qty,product_name,brand_id,brand_name
225266084,2273051977830,"Samsung Galaxy Tab S7 FE WiFi - được Samsung cho ra mắt với vô vàn tính năng cùng nhiều ưu điểm nổi bật hơn so với các đối thủ trong tầm giá, tablet hỗ trợ bút S Pen nhằm phục vụ các công việc của bạn...",6690000,12990000,,6300000,48,10,,available,,1000,1000,,18802,Samsung
209927605,2345506770936, ...,2689000,3100000,,411000,13,22,,available,,1000,1000,,147856,Kindle
200995800,4540673361107,"Thông số kỹ thuậtMàn hình6.5 inch, IPS LCD, HD, 720 x 1600 PixelsCamera sau8.0 MPCamera Selfie5.0 MPRAM2 GBBộ nhớ trong32 GBCPUUnisoc SC9863A1Dung lượng pin500...",1690000,2490000,,800000,32,12,,available,,1000,1000,,247549,Realme
264051117,2790855183962,"-Với tính năng thay đổi giọng nói: giọng nói của bạn có thể được thay đổi khi gọi. -Với một loa chất lượng tốt, bạn có thể nhận được giọng nói rất rõ ngay cả ở những khu vực đông đúc và ồn ào.-Thiết k...",62000,88000,,26000,30,7,,available,,1000,1000,,8181541,SOTHING Xiangwu
103168071,2540897708799,"Chính hãng, Nguyên seal, Mới 100%Đã kích hoạt bảo hành điện tử 6060, nguyên seal chưa khuiMiễn phí giao hàng toàn quốcSIM Nano-SIM, hỗ trợ 4GLoại Màn hình cảm ứng IPS LCDKích thước: 8.7 incheĐộ phân g...",4490000,4490000,,0,0,45,,available,,1000,1000,,18802,Samsung
215902961,5857202564064,"Thông số kỹ thuật: Màn hình: IPS LCD, 6.08"", Full HD+ Hệ điều hành: Android 10Camera sau: Chính 8 MP & Phụ 8 MP, 2 MP Camera trước: 8 MP CPU: MTK6739 Quad core RAM: 3GB Bộ nhớ trong: 32 GB...",1099000,1699000,,600000,35,20,,available,,1000,1000,,111684,Itel
272273680,7151197509141,...,3790000,3990000,,200000,5,0,,available,,1000,1000,,18802,Samsung
173387789,3214054442334,"Độ phân giải màn hình cực caoMáy đọc sách All New Kindle Oasis 3 với màn hình 7 inch và mật độ ảnh 300 ppi, văn bản hiển thị trên thiết bị với chất lượng sắc nét, đọc như giấy thật ngay cả trong ánh ...",5680000,5680000,,0,0,11,,available,,1000,1000,,147856,Kindle
125590981,4728167558517,"Giải trí hoàn hảo với màn hình siêu rộng 6.82” chuẩn HD+ mang đến trải nghiệm giải trí sắc nét và thưởng thức nội dung trọn vẹn.Pin bền bỉ dài ngày, Pin trâu bền bỉ 6000 mAh cho thời gian làm việc và ...",1550000,1550000,,0,0,32,,available,,1000,1000,,19673,Nokia
214603586,2474301171408,"Đắm mình vào trải nghiệm giải tríGiải trí bất tận mỗi ngày, thoải mái thưởng thức nhiều nội dung hơn với màn hình tràn viền vô cực Infinity-V 6,5inch trên Galaxy A04e. Tận hưởng nội dung hiển thị rõ ...",2099000,2690000,,591000,22,8,,available,,1000,1000,,18802,Samsung
230155305,1901131422256,"Cấu hình Điện thoại Xiaomi Redmi Note 10 JE Màn hình: IPS LCD 6.5"" Full HD+Hệ điều hành: Android 11Camera sau: Chính 48 MP & Phụ 2 MP, 2 MPCamera trước: 8 MPChip: Snapdragon 480 5GRAM: 4 GB...",2499000,3990000,,1491000,37,23,,available,,1000,1000,,25422,Xiaomi
270683809,4469205749301,...,20990000,29990000,,9000000,30,2,,available,,1000,1000,,18802,Samsung
